[
  {
    "id": "a1198a20-5a40-4eb7-b47f-a553db958963",
    "externalId": "KPMG",
    "name": "KPMG",
    "sharingUsers": true,
    "sharingAccounts": false
  },
  {
    "id": "a1198a20-5a40-4eb7-b47f-a553db920429",
    "externalId": "Backbase",
    "name": "Backbase",
    "sharingUsers": false,
    "sharingAccounts": true
  }
]
